{
  "$schema": "https://github.com/J-mazz/sys-scan/schema/v4.json",
  "version": "ground_truth_v1",
  "enriched_findings": [
    {
      "id": "finding-1",
      "title": "Sample finding",
      "severity": "medium",
      "risk_score": 55,
      "base_severity_score": 40,
      "description": "Example enriched finding",
      "metadata": {
        "scanner": "sample"
      },
      "category": "sample",
      "tags": [
        "sample"
      ],
      "risk_subscores": {
        "impact": 0.4,
        "exposure": 0.3,
        "anomaly": 0.2,
        "confidence": 0.9
      },
      "correlation_refs": [
        "corr-1"
      ],
      "baseline_status": "new",
      "severity_source": "raw",
      "allowlist_reason": null,
      "probability_actionable": 0.6
    }
  ],
  "correlations": [
    {
      "id": "corr-1",
      "title": "Sample correlation",
      "rationale": "Linked sample finding",
      "related_finding_ids": [
        "finding-1"
      ],
      "risk_score_delta": 5,
      "tags": [
        "sample"
      ],
      "severity": "medium"
    }
  ],
  "reductions": {},
  "summaries": {},
  "actions": [
    {
      "id": "action-1",
      "title": "Remediate sample",
      "description": "Apply sample remediation",
      "priority": "medium",
      "severity": "medium"
    }
  ],
  "raw_reference": {
    "results": [
      {
        "scanner": "sample",
        "findings": [
          {
            "id": "raw-1",
            "title": "Raw sample",
            "severity": "medium",
            "description": "Raw finding for reference",
            "metadata": {
              "source": "sample"
            }
          }
        ]
      }
    ],
    "warnings": [],
    "errors": []
  }
}